question,a_option,b_option,c_option,d_option,e_option,answer
apa yg dimaksud dengan fontosintetis,proses pembakaran kalori,gatau mau dijawab apa,ini lagi gatau juga w,yo ndak tau,ko tanya og tanya saya ,a
Siapa nama presiden Indonesia yang pertama?,Ir Soekarno,Joko Widodo,Megawati Soekarno Putri,Bj Habibie,Soeharto,a
Perintah untuk menampilkan list files dan dir di linux adalah,dir,curl,wget,ls,sl,d
Syntax loop pada python adalah,for ,print,class ,def,with ,a
Library untuk kebutuhan data science di python adalah,requests,bs4 ,flask ,threading,pandas,e
Siapa pencipta pertama kernel linux?,Bill Gates,Linus Trovalds,bapak saya,albert einstein,alexander graham bell,b
